<?xml version="1.0" encoding="utf-8"?>
<MonsterGroups xmlns:xsd="http://www.w3.org/2001/XMLSchema" xmlns:xsi="http://www.w3.org/2001/XMLSchema-instance" xsi:noNamespaceSchemaLocation="MonsterGroups.xsd">
    <MonsterGroupData>
        <Name>Dragons</Name>
        <Member>T Flying Dragon</Member>
        <Member>T Dragon</Member>
        <Member>H Flying Dragon</Member>
        <Member>H Dragon</Member>
    </MonsterGroupData>
    <MonsterGroupData>
        <!-- does not include imp -->
        <Name>Demons</Name>
        <Member>Demon</Member>
        <Member>Winged Dragon</Member>
    </MonsterGroupData>
    <MonsterGroupData>
        <Name>Goblins</Name>
        <Member>Goblin with Spear</Member>
        <Member>Goblin with Great Sword</Member>
        <Member>Goblin with Axe</Member>
    </MonsterGroupData>
    <MonsterGroupData>
        <Name>Wolves</Name>
        <Member>Wolf1</Member>
        <Member>Wolf2</Member>
    </MonsterGroupData>
    <MonsterGroupData>
        <Name>Trolls</Name>
        <Member>T Troll</Member>
        <Member>H Troll</Member>
    </MonsterGroupData>
    <MonsterGroupData>
        <Name>Spiders</Name>
        <Member>T Spider</Member>
        <Member>H Spider</Member>
    </MonsterGroupData>
    <MonsterGroupData>
        <Name>Serpents</Name>
        <Member>T Serpent</Member>
        <Member>H Serpent</Member>
    </MonsterGroupData>
    <MonsterGroupData>
        <Name>Bats</Name>
        <Member>Giant Bat</Member>
    </MonsterGroupData>
    <MonsterGroupData>
        <Name>Giants</Name>
        <Member>Giant</Member>
    </MonsterGroupData>
    <MonsterGroupData>
        <Name>Ogres</Name>
        <Member>Ogre</Member>
    </MonsterGroupData>
</MonsterGroups>
